{
  "$schema": "http://json-schema.org/draft-07/schema#",
  "$id": "https://fengyu.dev/plugin/manifest.schema.json",
  "title": "FengYu plugin manifest",
  "type": "object",
  "additionalProperties": true,
  "required": ["schemaVersion", "id", "name", "version", "ui"],
  "properties": {
    "schemaVersion": { "type": "integer", "const": 1 },
    "id": { "type": "string", "pattern": "^[a-z0-9]+(?:[.-][a-z0-9]+)+$" },
    "name": { "type": "string", "minLength": 1 },
    "description": { "type": "string" },
    "version": { "type": "string", "pattern": "^\\d+\\.\\d+\\.\\d+(?:[-+].+)?$" },
    "author": { "type": "string" },
    "icon": { "type": "string" },
    "category": { "type": "string" },
    "homepage": { "type": "string" },
    "official": { "type": "boolean" },
    "ui": {
      "type": "object",
      "required": ["entry"],
      "properties": { "entry": { "type": "string", "minLength": 1 } }
    },
    "backend": {
      "type": "object",
      "properties": {
        "command": { "type": "string" },
        "protocol": { "type": "string", "enum": ["json-rpc-2.0"] }
      }
    },
    "permissions": {
      "type": "array",
      "items": {
        "type": "string",
        "enum": [
          "files.read",
          "files.write",
          "network",
          "network.email",
          "clipboard.read",
          "clipboard.write",
          "notifications",
          "database"
        ]
      }
    },
    "aiTools": {
      "type": "array",
      "items": {
        "type": "object",
        "required": ["name", "description", "method", "inputSchema"],
        "properties": {
          "name": { "type": "string", "minLength": 1 },
          "description": { "type": "string" },
          "method": { "type": "string", "minLength": 1 },
          "inputSchema": { "type": "string", "minLength": 1 }
        }
      }
    }
  }
}
