{
  "schemaVersion": 1,
  "id": "com.example.full",
  "name": "Full",
  "description": "Full fixture",
  "version": "1.0.0",
  "author": "Example",
  "icon": "puzzle-outline",
  "category": "other",
  "ui": { "entry": "ui/index.html" },
  "backend": { "command": "java -jar backend/worker.jar", "protocol": "json-rpc-2.0" },
  "permissions": ["files.read", "files.write", "database", "network.email"],
  "official": false,
  "aiTools": [{
    "name": "hello",
    "description": "Say hello",
    "method": "hello",
    "inputSchema": "{\"type\":\"object\",\"properties\":{\"name\":{\"type\":\"string\"}},\"required\":[\"name\"]}"
  }]
}
